{
  "submissionId": "8191c165-e9e4-4fd7-ac6d-5bfd04690f77",
  "submissionStatus": "PENDING",
  "prosecutionSubmissionDetails": {
    "prosecutingAuthority": "GAAAA01",
    "urn": "URN500",
    "informant": "Fred",
    "writtenChargePostingDate": "2015-04-04"
  },
  "defendant": {
    "prosecutorDefendantId": "123",
    "defendantPerson": {
      "title": "Mr",
      "forename": "Joe",
      "surname": "Bloggs",
      "selfDefinedInformation": {
        "gender": 1,
        "ethnicity": "W1"
      }
    },
    "documentationLanguage": "E",
    "prosecutorCosts": "+150.00",
    "hearingLanguage": "E",
    "offences": [
      {
        "cjsOffenceCode": "OFCODE12",
        "offenceSequenceNo": 1,
        "offenceCommittedDate": "2015-04-04",
        "offenceDateCode": 1,
        "offenceWording": "",
        "prosecutorCompensation": "+1.00",
        "backDuty": "200.00",
        "backDutyDateFrom": "2018-04-09",
        "backDutyDateTo": "2018-05-09",
        "vehicleMake": "Ford",
        "vehicleRegistrationMark": "AB11 ABC"
      }
    ]
  }
}
